name,ability,description,example_uses
Acrobatics,Dexterity,Balance and coordination,"Staying upright on a rocking ship, walking a tightrope, performing acrobatic stunts"
Arcana,Intelligence,Knowledge of magic and magical items,"Recalling lore about spells, identifying a magic circle, recognizing a spell being cast"
Athletics,Strength,Physical prowess and stamina,"Climbing, jumping, swimming, breaking down doors, grappling"
Deception,Charisma,Misleading others through words or actions,"Lying convincingly, disguising yourself, creating a diversion"
Perception,Wisdom,Noticing details in your environment,"Spotting hidden objects, overhearing conversations, detecting ambushes"
Stealth,Dexterity,Moving silently and hiding,"Sneaking past guards, picking pockets, hiding in shadows"

